{
  "$schema": "lecture-manifest.schema.json",
  "version": 1,
  "deck": {
    "id": "Math130Unit2A",
    "title": "Exponential Functions",
    "section": "Section 4.2",
    "source": "Math130Unit2A.pptx",
    "canonical": true
  },
  "objectives": [
    {
      "id": "u2a-graph",
      "text": "recognize and graph exponential functions"
    },
    {
      "id": "u2a-e",
      "text": "evaluate exponential expressions and use the natural base e"
    },
    {
      "id": "u2a-interest",
      "text": "select and apply simple, periodic, and continuous interest formulas"
    },
    {
      "id": "u2a-model",
      "text": "interpret exponential growth and decay models"
    }
  ],
  "sessions": [
    {
      "id": "unit2a",
      "title": "Exponential Functions",
      "subtitle": "Growth, decay, compound interest, and modeling",
      "output": "Math130Unit2A.html",
      "duration_minutes": 55,
      "min_slides": 25,
      "max_slides": 30,
      "rehearsal": {
        "status": "pending_live_rehearsal",
        "planned_instruction_minutes": 50.0,
        "reserved_buffer_minutes": 5,
        "available_flex_minutes": 5.0,
        "stopping_points": [
          {
            "after_block": "math130unit2a-u2a-graph-synthesize",
            "planned_elapsed": 12.5,
            "action": "Continue if on time; if more than 3 minutes behind, shorten discussion while preserving practice and feedback."
          },
          {
            "after_block": "math130unit2a-u2a-e-synthesize",
            "planned_elapsed": 24.5,
            "action": "Continue if on time; if more than 3 minutes behind, shorten discussion while preserving practice and feedback."
          },
          {
            "after_block": "math130unit2a-u2a-interest-synthesize",
            "planned_elapsed": 36.5,
            "action": "Continue if on time; if more than 3 minutes behind, shorten discussion while preserving practice and feedback."
          },
          {
            "after_block": "math130unit2a-u2a-model-synthesize",
            "planned_elapsed": 48.5,
            "action": "Continue if on time; if more than 3 minutes behind, shorten discussion while preserving practice and feedback."
          }
        ]
      },
      "pilot": {
        "candidate": true,
        "status": "pending_classroom_use"
      },
      "blocks": [
        {
          "id": "unit2a-title",
          "title": "Exponential Functions",
          "phase": "activate",
          "component": "title",
          "objectives": [],
          "minutes": 0,
          "source_slides": [
            1
          ],
          "content": [
            "Growth, decay, compound interest, and modeling",
            "Section 4.2"
          ]
        },
        {
          "id": "unit2a-roadmap",
          "title": "Today’s Learning Roadmap",
          "phase": "activate",
          "component": "roadmap",
          "objectives": [
            "u2a-graph",
            "u2a-e",
            "u2a-interest",
            "u2a-model"
          ],
          "minutes": 0.5,
          "source_slides": [
            2
          ],
          "content": [
            "recognize and graph exponential functions",
            "evaluate exponential expressions and use the natural base e",
            "select and apply simple, periodic, and continuous interest formulas",
            "interpret exponential growth and decay models"
          ]
        },
        {
          "id": "math130unit2a-u2a-graph-activate",
          "title": "Predict: recognize and graph exponential functions",
          "phase": "activate",
          "component": "poll",
          "objectives": [
            "u2a-graph"
          ],
          "minutes": 1.0,
          "source_slides": [],
          "content": [
            "Which grows faster for large x: x² or 2ˣ? Explain before calculating."
          ],
          "instructor_notes": [
            "Require an individual prediction before discussion."
          ],
          "verification": []
        },
        {
          "id": "math130unit2a-u2a-graph-explain",
          "title": "recognize and graph exponential functions",
          "phase": "explain",
          "component": "concept",
          "objectives": [
            "u2a-graph"
          ],
          "minutes": 2.5,
          "source_slides": [
            3,
            4
          ],
          "content": [
            "An exponential function has the variable in the exponent: $f(x)=b^x$, where $b>0$ and $b\\ne1$.",
            "All parent exponential graphs pass through $(0,1)$, have domain $(-\\infty,\\infty)$, range $(0,\\infty)$, and asymptote $y=0$."
          ],
          "instructor_notes": [],
          "verification": []
        },
        {
          "id": "math130unit2a-u2a-graph-model",
          "title": "Model the Skill: recognize and graph exponential functions",
          "phase": "model",
          "component": "diagram",
          "objectives": [
            "u2a-graph"
          ],
          "minutes": 3.0,
          "source_slides": [
            5,
            6
          ],
          "content": [
            "Build and graph a five-point table for $f(x)=2^x$.",
            "For $x=-2,-1,0,1,2$, the values are $1/4,1/2,1,2,4$.",
            "Plot the five points and draw a smooth increasing curve through $(0,1)$.",
            "Domain: $(-\\infty,\\infty)$; range: $(0,\\infty)$; horizontal asymptote: $y=0$."
          ],
          "instructor_notes": [],
          "verification": [
            "Verify all plotted exponential points and asymptotes."
          ],
          "steps": [
            "For $x=-2,-1,0,1,2$, the values are $1/4,1/2,1,2,4$.",
            "Plot the five points and draw a smooth increasing curve through $(0,1)$.",
            "Domain: $(-\\infty,\\infty)$; range: $(0,\\infty)$; horizontal asymptote: $y=0$."
          ],
          "audit_checks": [
            "u2a-graph"
          ],
          "assets": [
            {
              "src": "assets/math130unit2a/slide-05-1.png",
              "alt": "Graph of the exponential function two to the x"
            }
          ]
        },
        {
          "id": "math130unit2a-u2a-graph-practice",
          "title": "You Try: recognize and graph exponential functions",
          "phase": "practice",
          "component": "practice",
          "objectives": [
            "u2a-graph"
          ],
          "minutes": 3.0,
          "source_slides": [
            7,
            8
          ],
          "content": [
            "Graph $g(x)=3^x$ using five points. Label the intercept, domain, range, and asymptote."
          ],
          "instructor_notes": [
            "Pause before revealing the solution."
          ],
          "verification": [],
          "answer": [
            "Points: $(-2,1/9),(-1,1/3),(0,1),(1,3),(2,9)$.",
            "Intercept: $(0,1)$; domain: $(-\\infty,\\infty)$; range: $(0,\\infty)$; asymptote: $y=0$."
          ]
        },
        {
          "id": "math130unit2a-u2a-graph-feedback",
          "title": "Check and Diagnose: recognize and graph exponential functions",
          "phase": "feedback",
          "component": "misconception",
          "objectives": [
            "u2a-graph"
          ],
          "minutes": 2.0,
          "source_slides": [
            9,
            10
          ],
          "content": [
            "Do not confuse $x^2$ with $2^x$.",
            "A larger growth base is steeper to the right; a base between 0 and 1 produces decay."
          ],
          "instructor_notes": [
            "Ask students to explain why the incorrect path fails."
          ],
          "verification": [
            "Verify all plotted exponential points and asymptotes."
          ]
        },
        {
          "id": "math130unit2a-u2a-graph-synthesize",
          "title": "Make It Stick: recognize and graph exponential functions",
          "phase": "synthesize",
          "component": "summary",
          "objectives": [
            "u2a-graph"
          ],
          "minutes": 0.5,
          "source_slides": [
            11
          ],
          "content": [
            "Explain how the base determines growth or decay and name the four invariant graph features."
          ],
          "instructor_notes": [
            "If more than 3 minutes behind, shorten discussion but preserve the next practice and feedback slides."
          ],
          "verification": [],
          "pacing_checkpoint": "Check elapsed time before beginning the next objective."
        },
        {
          "id": "math130unit2a-u2a-e-activate",
          "title": "Predict: evaluate exponential expressions and use the natural base e",
          "phase": "activate",
          "component": "poll",
          "objectives": [
            "u2a-e"
          ],
          "minutes": 1.0,
          "source_slides": [],
          "content": [
            "What value should $e^0$ have, and why must that be true?"
          ],
          "instructor_notes": [
            "Require an individual prediction before discussion."
          ],
          "verification": []
        },
        {
          "id": "math130unit2a-u2a-e-explain",
          "title": "evaluate exponential expressions and use the natural base e",
          "phase": "explain",
          "component": "formula",
          "objectives": [
            "u2a-e"
          ],
          "minutes": 2.5,
          "source_slides": [
            12
          ],
          "content": [
            "$e\\approx2.71828$ is the natural base.",
            "Calculator entry requires parentheses around negative or fractional exponents."
          ],
          "instructor_notes": [],
          "verification": []
        },
        {
          "id": "math130unit2a-u2a-e-model",
          "title": "Model the Skill: evaluate exponential expressions and use the natural base e",
          "phase": "model",
          "component": "derivation",
          "objectives": [